{
  "id": "helix.library",
  "displayName": "Library",
  "version": "0.1.0",
  "requiresHelix": ">=1.0.0",
  "artifacts": ["frontend", "backend"],
  "dependsOn": [
    {"id": "helix.access", "version": "^0.1.0"},
    {"id": "helix.tags", "version": "^0.1.0"},
    {"id": "helix.eln", "version": "^0.1.0"}
  ],
  "description": "Browse, search, and organize your lab's entries, protocols, and folder structure."
}
