{
  "id": "helix.home",
  "displayName": "Home",
  "version": "0.1.0",
  "requiresHelix": ">=1.0.0",
  "artifacts": ["frontend", "backend"],
  "dependsOn": [{"id": "helix.lims", "version": "^0.1.0"}],
  "description": "Your lab dashboard — greeting, activity feed, and quick navigation to all hubs."
}
